{
  "task_id":"FRONTIER-QUANT-MECHANISM-DISTINCT-002","task_type":"QUANT_MECHANISM","required_capability":"quant_mechanisms","status":"CLAIMED","priority":70,
  "inputs":{"objective":"Find exactly one causally distinct quantitative/market-mechanism candidate from admissible public documentary or literature evidence, screen Legacy before freeze, and freeze at most one CandidateHypothesis without inspecting candidate returns.","frontier_id":"QUANT_MECHANISM_DISTINCT","derivation_key":"a95d120f9c12c776a3f99445bc95415e6fa0328d1cc4e5f81be2aac408db55a7","legacy_gate_required":true,"causal_distinctness_required":true,"source_policy":"PUBLIC_OR_EXPLICITLY_AUTHORIZED_NON_OUTCOME_SOURCES_ONLY"},
  "allowed_actions":["read fresh Legacy ledger, duplication map and negative knowledge before ideation","research one bounded causal market mechanism from admissible public evidence","map payer or forced actor, causal chain, expression, confounders and falsification","actively seek mechanism-level disconfirmation","persist at most one frozen CandidateHypothesis and exactly one VALIDATION handoff, or persist NO_CANDIDATE"],
  "forbidden_actions":["signal-to-return calculation","backtest","future outcome inspection","parameter tuning against outcomes","prospective observation","capital allocation","order generation","live trading"],
  "success_condition":"One Legacy-screened, causally distinct quantitative/mechanism CandidateHypothesis is frozen and handed to independent validation, or a durable NO_CANDIDATE result is persisted.",
  "authority":{"scope":"BOUNDED_FRONTIER_DISCOVERY_AND_FREEZE_ONLY","economic_experiment_authorized":false,"prospective_observation_authorized":false,"real_capital_authorized":false,"live_trading_authorized":false},
  "lease":{"generation":1,"owner":"market-discovery-workflow","claimed_at":"2026-10-18T09:57:38Z","expires_at":"2026-10-18T10:52:38Z"},"created_at":"2026-10-18T09:44:15Z","updated_at":"2026-10-18T09:57:38Z",
  "derivation":{"type":"EMPTY_QUEUE_FRONTIER_REFILL","frontier_id":"QUANT_MECHANISM_DISTINCT","sequence":2,"derivation_key":"a95d120f9c12c776a3f99445bc95415e6fa0328d1cc4e5f81be2aac408db55a7","selection_policy":"LOWEST_ISSUED_COUNT_THEN_HIGHEST_PRIORITY_THEN_FRONTIER_ID","target_lane":"market_discovery","steward_lane":"integrator_portfolio"}
}
